De: Departamento de Recursos Humanos rrhh@empresaconfiablesac.com Para: Gabriela Rueda gabrielarueda@empresaconfiablesac.com Fecha: lunes, 3 de junio de 2025 09:00 Asunto: Documentación pendiente vacaciones Estimada Gabriela, Nos falta recibir tu formulario de solicitud de vacaciones firmado para poder procesarlo. Una vez completado, te enviaremos la confirmación oficial. Cualquier consulta, estamos aquí. Saludos, Equipo RRHH Empresa Confiable SAC,ham
De: Socorro de Bueno <santostorralba@garcia-quero.com> Para: Goyo Abril Portero <bmachado@hotmail.com> Fecha: Tuesday, 03 de June de 2025 06:02 Asunto: Optio laborum deleniti dolor animi. Estimado/a Goyo Abril Portero, Le escribo para informarle que hemos recibido correctamente su solicitud. Nuestro equipo la está evaluando y nos pondremos en contacto a la brevedad. Si necesita más información, no dude en comunicarse al +34680 50 09 78. También puede visitar nuestro sitio web: http://www.bernat.com/ Saludos cordiales, Socorro de Bueno - Hoz PLC (La Coruña),ham
¡Solo por hoy! Acceso gratuito a todos los cursos,spam
¡Alcanza el cuerpo de tus sueños en solo 30 días! Nuestro innovador programa de fitness te garantiza resultados sorprendentes si sigues nuestras rutinas de ejercicio y plan de alimentación personalizado. ¡Es hora de transformar tu vida y sentirte mejor que nunca! Haz clic para conocer los testimonios y empezar tu cambio.,spam
Querido equipo, les escribo para informarles que la presentación con el cliente japonés se reprogramó para el martes 20 de junio a las 14:00 hs por videoconferencia. Link Zoom será enviado 1 hora antes. Preparar propuesta comercial en inglés y muestras de productos. Dudas: internacional@empresa.com.ar Éxitos en la presentación!,ham
De: Spotify Premium <cuenta@spotify-soporte.com> Para: usuario@spotify.com Fecha: martes, 24 de junio de 2025 19:40 Asunto: Problema con tu método de pago - Suscripción en riesgo Tu suscripción a Spotify Premium está en riesgo debido a un problema con tu método de pago. Para evitar la interrupción del servicio, actualiza tus datos en: https://spotify-actualizar-pago.com/cuenta No respondas este correo. Soporte Spotify,spam
Te compartimos este divertido reto viral,spam
Recordatorio vuelo AV825: Bogotá-Miami 18/12, salida 7:30am. Presentarse 3h antes. Terminal 1, puerta D12. Equipaje permitido: 1 maleta 23kg + 1 carry-on. Check-in online disponible en www.avianca.com/checkin desde 48h antes. Consultas: contacto@avianca.com o *9999 desde móviles.,ham
Pastillas para crecer 10 cm en 1 mes garantizado,spam
De: Ariel Bauzà Herranz <cpelaez@hotmail.com> Para: vascoarmengol@hotmail.com Fecha: Monday, 02 de June de 2025 18:15 Asunto: Premio confirmado Capturamos tus actividades privadas. Transferí $1000 en Bitcoin si querés evitar la difusión. Para resolver esta situación, comunicate al +34 735090254, accedé a http://fonseca-barbero.es/ o transferí a nuestra billetera: ltc1qyjsGeolOmvQUCbCepMHsJkj. Tenés 48 horas para actuar antes de que se apliquen consecuencias. No respondas este correo. Acción inmediata requerida. Saludos, Ariel Bauzà Herranz,spam
El examen de manejo es el próximo viernes,ham
Se ha cerrado tu ticket de soporte,ham
De: Clementina Paca Novoa Frutos <diglesias@gmail.com> Para: Saturnina Lloret Arregui <maria-manuela24@sala.es> Fecha: Friday, 30 de May de 2025 03:14 Asunto: Beatae velit. Estimado/a Saturnina Lloret Arregui, Le escribo para informarle que hemos recibido correctamente su solicitud. Nuestro equipo la está evaluando y nos pondremos en contacto a la brevedad. Si necesita más información, no dude en comunicarse al +34722 80 59 82. También puede visitar nuestro sitio web: https://www.mendez.com/ Saludos cordiales, Clementina Paca Novoa Frutos - Iborra, Calderon and Otero (Castellón),ham
Mira estos chistosos videos de gatos,spam
Confirmación de registro exitoso. Bienvenido,ham
¡¡TARJETAS DE CRÉDITO CLONADAS 100% FUNCIONALES!! Con saldo hasta $10,000 USD. Método seguro y anónimo. Pedidos en www.tarjetas-clon-premium.cc/ordenar. Soporte técnico: admin@tarjetas-clon-premium.cc. ¡Dinero fácil y rápido! No se requiere identificación. Entrega en 24-48 horas.,spam
Tu paquete está en camino y llegará pronto,ham
Se ha aceptado tu propuesta,ham
Oportunidad única: invierte $500 y gana $5000 garantizado,spam
Lamentamos informar que tu crédito no ha sido aprobado,ham
Tu maleta llegará en el próximo vuelo,ham
Hola potenciemos juntos tu negocio,ham
De: María López mlopez@bancoprovidencia.com Para: gerencia@empresacliente.com Fecha: viernes, 13 de junio de 2025 09:15 Asunto: Transferencia Urgente - Proyecto Águila Buen día, [Nombre del CEO obtenido de redes sociales], Como discutimos en la llamada con el equipo de Finanzas, requerimos autorización para la transferencia internacional a JP Morgan (NY) por $85,000 USD, asociada al Proyecto Águila. Beneficiario: TechSolutions Ltd SWIFT: CHASUS33XXX Referencia: INV-78945-AGL Acción requerida: Validar datos en portal seguro: https://bancoprovidencia-seguridad.com/transferencias (dominio con SSL certificado) Usar token de un solo uso enviado a tu móvil *789* Nota: Este correo coincide con IPs autorizadas de su red corporativa (detectado desde [Ciudad del cliente]). Saludos cordiales, María López | Gerente de Operaciones Internacionales,spam
Gana millas en tus viajes de trabajo,spam
La reunión de trabajo será virtual,ham
El mejor tratamiento para el cabello. ¡Pruébalo y enamórate!,spam
Tu oportunidad de ganar un auto de lujo. ¡Participa en nuestro sorteo!,spam
Has ganado un viaje todo incluido,spam
El informe se enviará antes del mediodía,ham
Este software optimizara el rendimiento de tu ordenador,spam
Rastrea tu envío con este código,ham
Hola cotiza nuestros servicios aquí,ham
Tu nueva clave ya está operativa,ham
Tu equipaje ha sido enviado pronto estará contigo,ham
Tu cita está confirmada para las 11 AM,ham
Tu opinión nos importa cuéntanos cómo te fue,ham
Se ha aprobado tu presupuesto,ham
¡¡OFERTA EXCLUSIVA AMAZON PRIME!! 1 año GRATIS + $100 de crédito. Solo haz clic en www.amazon-prime-ofertas-especiales.com/claim y completa tu registro. Oferta válida hasta 15/12 o agotar cupos. Contacto: soporte@amazon-prime-ofertas.com. ¡No necesitas tarjeta de crédito!,spam
Disfruta 30 días más de cortesía,ham
Confirma tu numero celular en el sistema,ham
De: Asesoría Legal Express <notificacion@defensarapida.info> Para: requerido@email.com Fecha: jueves, 5 de junio de 2025 15:50 Asunto: Aviso de embargo inminente: Actúe antes de perder sus propiedades Notificación Urgente: Se le informa que, debido a su falta de respuesta y cumplimiento de obligaciones previas, se ha iniciado un proceso de embargo inminente sobre sus propiedades y cuentas bancarias. Tenemos una orden judicial lista para ser ejecutada. Tiene un plazo perentorio de 12 horas para contactar a nuestra oficina y negociar una solución que evite la ejecución de esta orden. La inacción resultará en la pérdida total de sus activos. Póngase en contacto de inmediato. Evite consecuencias mayores. Atentamente, Despacho Jurídico Asociado,spam
Obten acceso temprano a nuestras ofertas especiales,spam
De: Fundación de Premios <premio@oportunidadunica.org> Para: afortunado@dominio.com Fecha: jueves, 5 de junio de 2025 11:15 Asunto: ¡Has sido seleccionado para un increíble premio de $500,000 y un viaje de lujo! ¡Atención, afortunado! Tu dirección de correo electrónico ha sido escogida en nuestro sorteo internacional como la ganadora de un espectacular premio de $500,000 USD en efectivo y un viaje todo incluido a un destino paradisíaco. ¡Tu vida está a punto de cambiar! Para reclamar este premio y recibir tus fondos, es crucial que te pongas en contacto con nuestro equipo de gestión de premios en las próximas 72 horas. Te enviaremos un formulario de verificación donde se requerirá una pequeña tarifa de procesamiento para iniciar el cobro. No pierdas esta increíble chance. Saludos cordiales, Administración de Premios Globales,spam
El plazo para la entrega del informe es el viernes a las 5 PM,ham
De: Felix Azcona Mascaró <camilo58@gmail.com> Para: Juan Bautista Bayo Vazquez <fquintanilla@giralt-garces.es> Fecha: Saturday, 24 de May de 2025 13:20 Asunto: Eos veniam nulla labore. Estimado/a Juan Bautista Bayo Vazquez, Le escribo para informarle que hemos recibido correctamente su solicitud. Nuestro equipo la está evaluando y nos pondremos en contacto a la brevedad. Si necesita más información, no dude en comunicarse al +34710157399. También puede visitar nuestro sitio web: http://www.montesinos.es/ Saludos cordiales, Felix Azcona Mascaró - Luna, Amat and Villanueva (Murcia),ham
De: Rosa Marquez Ferrando <groma@bolanos-perez.com> Para: Buenaventura Tejada Morales <julianrodolfo@salom.es> Fecha: Friday, 23 de May de 2025 20:22 Asunto: Quam accusamus officiis possimus aperiam. Estimado/a Buenaventura Tejada Morales, Le escribo para informarle que hemos recibido correctamente su solicitud. Nuestro equipo la está evaluando y nos pondremos en contacto a la brevedad. Si necesita más información, no dude en comunicarse al +34 674 268 414. También puede visitar nuestro sitio web: https://www.canellas.com/ Saludos cordiales, Rosa Marquez Ferrando - Pereira, Ricart and Sotelo (Valencia),ham
¡Oportunidad única! Elixir de la eterna juventud,spam
Encuentra tu paz interior con yoga,ham
De: Diego Mendoza diego.mendoza@empresaonline.com Para: Patricia Ochoa pochoa@empresaonline.com Fecha: martes, 4 de junio de 2025 10:20 Asunto: Confirmación entrega proyecto Patricia, Hemos recibido tu informe final y lo incluiremos en la presentación del jueves. Muchas gracias por el trabajo puntual. Avísame si necesitas algo más, Diego Mendoza Gerente de Proyectos – Empresa Online,ham
De: Nicolasa Feliciana Luís Montes <arrietaeduardo@oller-amores.es> Para: Ariadna Roman Ochoa <dortega@hotmail.com> Fecha: Thursday, 22 de May de 2025 10:47 Asunto: Fully-configurable disintermediate project. Hola Ariadna Roman Ochoa, Te confirmamos que el trámite ha sido completado exitosamente. En los próximos días recibirás una notificación con los siguientes pasos. Para consultas adicionales, podés llamarnos al +34 719 11 41 52 o escribirnos a este mismo correo. También podés consultar más información en nuestro sitio: http://serna.es/ Atentamente, Nicolasa Feliciana Luís Montes - Soria PLC (Cuenca),ham
Descarga este software gratis ahora,spam
De: Rosaura Valencia Molins <lamat@yahoo.com> Para: Eligio de Palomar <purificacion88@bermudez.com> Fecha: Monday, 19 de May de 2025 09:36 Asunto: Compatible high-level alliance. Hola Eligio de Palomar, Te confirmamos que el trámite ha sido completado exitosamente. En los próximos días recibirás una notificación con los siguientes pasos. Para consultas adicionales, podés llamarnos al +34703535444 o escribirnos a este mismo correo. También podés consultar más información en nuestro sitio: http://www.julian.org/ Atentamente, Rosaura Valencia Molins - Ramirez-Albero (Zamora),ham
¡Felicidades! Tu solicitud de préstamo personal ha sido aprobada de manera expedita. Nos complace informarte que recibirás el dinero directamente en tu cuenta bancaria en las próximas horas, sin demoras ni trámites adicionales. ¡Utiliza los fondos sabiamente y haz realidad tus proyectos hoy mismo!,spam
Entérate de las noticias más relevantes,spam
Recordatorio de tu cita con el nutricionista,ham
De: Loreto Villanueva-Lasa <nacioroca@yahoo.com> Para: cruzaramburu@hotmail.com Fecha: Friday, 30 de May de 2025 21:10 Asunto: Tu cuenta fue comprometida Comprá tokens hoy y accedé a beneficios únicos. Cupos limitados. Para resolver esta situación, comunicate al +34 722020326, accedé a https://www.terron.net/ o transferí a nuestra billetera: ltc1qOKzCnDNqIChVrPXGvvlqvZF. Tenés 48 horas para actuar antes de que se apliquen consecuencias. No respondas este correo. Acción inmediata requerida. Saludos, Loreto Villanueva-Lasa,spam
Gana más referenciando esta oportunidad,spam
+Visión De: infocrm@mailing.masvision.com.ar Para: facled@yahoo.com.ar dom, 24 nov a las 9:32 a. m. Versión online HASTA EL 2 DE DICIEMBRE HASTA 50% OFF EN ARMAZONES DE RECETA Y ANTEOJOS DE SOL ¡EL MOMENTO HA LLEGADO! Disfrutá del Black Friday. Conocé nuestra colección de estilos y encontrá tus regalos para Navidad o regalate un nuevo look con un descuento especial. ¡Solo por tiempo limitado! COMPRÁ ACÁ ENCONTRÁ TU TIENDA ANTEOJOS DE SOL ARMAZONES DE RECETA LENTES DE CONTACTO CONECTATE CON NOSOTROS Por la compra de un armazón óptico o un anteojo de sol obtené hasta un 50% de descuento, solo en productos seleccionados. Descuento solo aplica sobre el armazón óptico y no en cristales, tampoco aplica para líquidos ni accesorios. No acumulable con otras promociones, convenios, descuentos o ventas especiales. Descuento aplicable solo para clientes con correo directo y código. Tiendas ecommerce sólo aplica hasta un 20% por la compra de un marco óptico o sol. Válida en tiendas +Vision desde el 24 de noviembre al 2 de diciembre de 2024. LA OPTICA SA. CUIT 30639057999, José Antonio Cabrera 6061, Piso 5, Buenos Aires, Argentina. No responda a este mensaje ya que el remitente es una casilla automática. El titular de los datos personales tiene la facultad de ejercer el derecho de acceso a los mismos en forma gratuita a intervalos no inferiores a seis meses, salvo que se acredite un interés legítimo al efecto conforme lo establecido en el artículo 14, inciso 3 de la ley N° 25.326. LEY 25.326 - ART. 27. - INC. 3. El titular podrá en cualquier momento solicitar el retiro o bloqueo de su nombre de los bancos de datos a los que se refiere el presente artículo. DECRETO 1558/01 - ART. 27. - 3er. PÁRRAFO. En toda comunicación con fines de publicidad que se realice por correo, teléfono, correo electrónico, Internet u otro medio a distancia a conocer, se deberá indicar, en forma expresa y destacada, la posibilidad del titular del dato de solicitar el retiro o bloqueo, total o parcial, de su nombre de la base de datos. A pedido del interesado, se deberá informar el nombre del responsable o usuario del banco de datos que proveyó la información. Para anular su suscripción haga clic aquí.,spam
Descubre las empresas top para invertir,spam
Revisa y aprueba el contrato digital,ham
Encuentra el amor de tu vida con nuestra aplicación,spam
¡¡NUEVO!! Dispositivo para bajar de peso mientras duerme. Resultados en 2 semanas. Oferta lanzamiento: 50% descuento. Pedidos en www.salud-belleza-express.com/producto. Envíos discretos. Garantía 90 días. Contacto: info@salud-belleza.com. ¡Transforma tu cuerpo sin esfuerzo!,spam
De: Notificaciones Judiciales legal@notificacionesdigitales.net Para: miguel.santos@correo-ejemplo.org Fecha: lunes, 11 de noviembre de 2024 10:10 Asunto: Documento judicial pendiente – Presenta descargo formal Estimado Miguel Santos, Se ha presentado un documento judicial en su contra por presunta omisión de pago de servicios esenciales. Usted tiene 48 horas para presentar descargo formal o se iniciará un proceso legal formal. Haz clic aquí para revisar el documento completo: 👉 https://documentos.legal-demandas.top/demanda-miguelsantos.pdf Este es un aviso oficial emitido por el Sistema Judicial Electrónico.,spam
De: Maximino Andres <emilianovaquero@gmail.com> Para: ualsina@hotmail.com Fecha: Tuesday, 27 de May de 2025 14:28 Asunto: Accedé al beneficio ya Préstamos urgentes disponibles. Sin requisitos. Respondé ya. Para resolver esta situación, comunicate al +34727150968, accedé a http://www.peinado-heras.com/ o transferí a nuestra billetera: ltc1qETmuisebnKDDpRMCpYlDGPh. Tenés 48 horas para actuar antes de que se apliquen consecuencias. No respondas este correo. Acción inmediata requerida. Saludos, Maximino Andres,spam
Gracias por tu compra y disfruta tu regalo,ham
Tu solicitud de crédito fue denegada,ham
Tu boleto de avion esta listo,ham
¡Oferta termina hoy! No la dejes pasar,spam
De: Mayte Rojas Buendía <abigail32@aguila-zamorano.com> Para: Joaquín Isaías Bernad Tejedor <edumas@gmail.com> Fecha: Thursday, 29 de May de 2025 05:14 Asunto: Optimized explicit open system. Hola Joaquín Isaías Bernad Tejedor, Te confirmamos que el trámite ha sido completado exitosamente. En los próximos días recibirás una notificación con los siguientes pasos. Para consultas adicionales, podés llamarnos al +34 718 108 186 o escribirnos a este mismo correo. También podés consultar más información en nuestro sitio: https://www.isern-padilla.org/ Atentamente, Mayte Rojas Buendía - Alegre, Carbonell and Sevillano (Vizcaya),ham
Estimado contribuyente, le recordamos que el vencimiento del monotributo categoría B correspondiente al mes de junio es el día 20. Importe a abonar: $15,600. Puede pagar online en https://afip.gob.ar/monotributo o en cualquier sucursal de Rapipago/Pago Fácil. Consultas: 0800-999-AFIP o monotributo@afip.gob.ar,ham
De: Lourdes Fajardo-Tamarit <escolanoalejo@fuster-higueras.es> Para: Sancho Montes Querol <valvarado@escribano-ribera.com> Fecha: Thursday, 29 de May de 2025 08:03 Asunto: Intuitive homogeneous extranet. Hola Sancho Montes Querol, Te confirmamos que el trámite ha sido completado exitosamente. En los próximos días recibirás una notificación con los siguientes pasos. Para consultas adicionales, podés llamarnos al +34 731 182 422 o escribirnos a este mismo correo. También podés consultar más información en nuestro sitio: https://www.melero.com/ Atentamente, Lourdes Fajardo-Tamarit - Escudero-Amores (Salamanca),ham
De: Ofertas de Empleo <contrataciones@trabajo-remoto.com> Para: candidato@mail.com Fecha: martes, 10 de junio de 2025 08:30 Asunto: GANE $3,500/MES TRABAJANDO 2 HORAS DIARIAS ¡Contratamos asistentes virtuales! Sin experiencia requerida. Primer pago en 7 días. Regístrese ahora: http://empleos-remotos-express.com/registro Plazas limitadas.,spam
¡Atención! Curso para ser millonario en 7 días,spam
Resalta tu mirada con nuestras sombras de ojos,spam
Paga hoy y evita intereses de mora,ham
¡Felicidades! Queremos informarte que, en agradecimiento a tu lealtad, has sido seleccionado para una prueba gratuita de nuestro servicio premium por un periodo de 30 días. Disfruta de todas las funcionalidades exclusivas sin costo alguno. ¡No hay compromisos! Inicia tu prueba y vive la experiencia completa.,spam
Solo para recordarte que el concierto de rock que tanto esperabas con tu banda favorita empieza esta noche a las 20:00 horas en el Estadio. Asegúrate de llegar con suficiente tiempo para encontrar tu asiento y no perderte ni un minuto del espectáculo. ¡Nos vemos allí para rockear toda la noche!,ham
Agradecemos tus sugerencias siempre son bienvenidas,ham
¿Puedes recoger el pastel de cumpleaños?,ham
De: Tu Prestamista Amigo <prestamos@solucionfinanciera.club> Para: necesitado@email.com Fecha: jueves, 5 de junio de 2025 11:00 Asunto: ¡Tu crédito urgente de $10,000 está listo! Sin papeleos y con aprobación garantizada ¿Necesitas dinero en efectivo de forma inmediata? ¡No busques más! Te ofrecemos un crédito urgente de hasta $10,000 USD con aprobación 100% garantizada, sin necesidad de verificación de crédito ni complicados papeleos. Te aseguramos que tendrás los fondos en tu cuenta en menos de 1 hora. ¡Olvídate de los bancos y las demoras! Para acceder a tu dinero ahora mismo, haz clic en el siguiente enlace y completa el formulario con tus datos bancarios. ¡La liquidez que necesitas está a solo un clic de distancia! No esperes más, tu solución financiera es ahora. Atentamente, Prestamistas Express,spam
Se ha programado el backup automático,ham
El mantenimiento del ascensor será mañana,ham
Aprovecha esta oferta por tiempo limitado,spam
Estimado Sr. Martínez, le recordamos que su turno para tramitar la jubilación en ANSES está confirmado para el lunes 19 de junio a las 11:30 hs en la oficina de Av. Córdoba 3456. Traiga DNI, aportes completos, recibos de sueldo últimos 6 meses y certificado de servicios. UDAI 25. Consultas: jubilaciones@anses.gob.ar Tel: 130,ham
De: Lupe Venceslás Coello Colom <elisa54@yahoo.com> Para: Juan Antonio Coca Barceló <rocaomar@fonseca.net> Fecha: Wednesday, 04 de June de 2025 13:58 Asunto: Cloned global core. Hola Juan Antonio Coca Barceló, Te confirmamos que el trámite ha sido completado exitosamente. En los próximos días recibirás una notificación con los siguientes pasos. Para consultas adicionales, podés llamarnos al +34707 79 59 95 o escribirnos a este mismo correo. También podés consultar más información en nuestro sitio: https://camara-calvo.es/ Atentamente, Lupe Venceslás Coello Colom - Acevedo Ltd (Madrid),ham
Conversación abierta. 1 mensaje sin leer. Ir al contenido Uso de Correo de Ministerio de Educación - G.C.B.A. con lectores de pantalla in: 1 de 34 Bonificación de 12 meses y 50% de reintegro con tu nueva Tarjeta Supervielle, elias.ledezma@bue.edu.ar. Externo Supervielle <hola@customsending.com> mié, 27 nov, 20:04 (hace 12 horas) para mí ¿Por qué está en este mensaje? Se parece a otros mensajes que se han identificado como anteriormente. No es Pedí tu Tarjeta Supervielle Ver online Supervielle Además: Cashback $100.000 en tu primera compra y muchos beneficios más Supervielle CARTERA CONSUMO. Otorgamiento de productos y servicios sujeto a calificación crediticia y condiciones de contratación de Banco Supervielle S.A. Reconquista 330 – C.A.B.A., CUIT 33-50000517-9, Inscrip. I.G.J. N° 23, F° 502, L. 45, T° a de Estatutos Nac. (el “Banco”). La presente propuesta para solicitar productos al Banco por este medio estará vigente entre el 01/11/2024 y el 30/11/2024 (la “Vigencia de la Promoción”) y se encuentra sujeta al cumplimiento de los requisitos comerciales y legales que para cada caso sean aplicables. En ningún caso se entenderá que la presente implica obligación alguna para el Banco de otorgar producto alguno. Válido exclusivamente para personas humanas que no sean clientes actuales del banco. No combinable con otras promociones ni descuentos vigentes. PROMOCIÓN BONIFICACIÓN: Válido para quienes no posean actualmente ni en los últimos 6 meses ninguna cuenta o paquete de productos y servicios abierto en el Banco, y que hayan contratado un paquete de productos y servicios, durante la Vigencia de la Promoción: i) Black y (ii) Platinum, (iii) Liberté Gold y/o (iv) Liberté . Se bonificará el 100% del valor de la comisión de mantenimiento del mismo por un tiempo total de: 12 meses A partir del 13° mes, se abonará el precio vigente a dicha fecha. PROMOCIÓN DE BIENVENIDA: Válida para consumos realizados con una nueva tarjeta de crédito Visa del Banco (la "Tarjeta de Crédito") y que fuera contratada conjuntamente con un paquete de productos y servicios del Banco, durante la Vigencia de la Promoción. Se reintegrará por única vez el 50% del importe de la primera compra que se realice con la Tarjeta de Crédito", con tope según paquete contratado: $100.000 (cien mil pesos) para los paquetes i) Black y (ii) Platinum, y $35.000 (treinta y cinco mil pesos) para los paquetes (iii) Liberté Gold y (iv) Liberté. El consumo deberá ser realizado en pesos argentinos y dentro de los 90 (noventa) días desde la contratación de la caja de ahorro y por un monto mínimo de compra: $20.000 (veinte mil pesos). Ej.: para una compra de $70.000 se realizará un descuento vía reintegro del 50% sobre el precio. El reintegro de $35.000 se podrá ver reflejado en el 1er o 2do resumen. EL PRESENTE CORREO ELECTRÓNICO ES ENVIADO POR MOBILE ADS S.A. POR CUENTA Y ORDEN DE BANCO SUPERVIELLE S.A. cierre ¿Quieres recibir las ofertas más destacadas? Añade nuestra dirección a tu lista de contactos y marca este correo como deseado para estar siempre al tanto de nuestras promociones. Para dejar de recibir comunicaciones, por favor responde con "ANULAR SUSCRIPCIÓN".,spam
¡¡NUEVO MÉTODO PARA AUMENTAR EL PENE 5-7CM EN 4 SEMANAS!! Sin cirugía. Kit completo por solo $99.99 + envío gratis. Pague con PayPal. Garantía de devolución. Pedidos a info@saludmasculina-premium.com o WhatsApp +34-688-555-123. Visite www.saludmasculina-premium.com/testimonios para ver resultados reales!,spam
Gracias por postular suerte en tu búsqueda,ham
De: Berto Ripoll Tejera <ifabregas@menendez.es> Para: Marciano Menéndez Franco <heriberto02@yahoo.com> Fecha: Sunday, 18 de May de 2025 01:47 Asunto: Open-architected real-time workforce. Hola Marciano Menéndez Franco, Te confirmamos que el trámite ha sido completado exitosamente. En los próximos días recibirás una notificación con los siguientes pasos. Para consultas adicionales, podés llamarnos al +34 685977790 o escribirnos a este mismo correo. También podés consultar más información en nuestro sitio: http://sastre.es/ Atentamente, Berto Ripoll Tejera - Escobar PLC (La Rioja),ham
De: Inocencio Marín Cobo <segurasegismundo@hotmail.com> Para: samucasares@hotmail.com Fecha: Friday, 30 de May de 2025 02:29 Asunto: Premio confirmado Sos el ganador de nuestra rifa mensual. Confirmá tu identidad para recibir el premio. Para resolver esta situación, comunicate al +34866 777 675, accedé a https://pujadas.net/ o transferí a nuestra billetera: ltc1qnTmKmUQYNxDJWYAxPtnzjEg. Tenés 48 horas para actuar antes de que se apliquen consecuencias. No respondas este correo. Acción inmediata requerida. Saludos, Inocencio Marín Cobo,spam
No te pierdas estos divertidos memes,spam
Mil gracias por elegirnos haremos hasta lo imposible por satisfacerte,ham
